datetime,headline,source,summary,url
2023-07-28 13:57:51,"Google, Microsoft, and Meta can't stop talking about A.I. — here's why Apple rarely mentions it",CNBC,Apple's AI works in the background. And the company doesn't yell about it the way some of the other companies do. It doesn't need to.,https://finnhub.io/api/news?id=cedf53d086bb2b1bff2bf7dc307f2ec93979786f857849474db78371e9766a0a
2023-07-28 13:44:22,AI Mentions on the Rise in Tech Earnings Calls as Recession Talk Fades,Yahoo,"(Bloomberg) -- Tech firms in the US are talking less about recession and more about artificial intelligence this earnings season, signaling that companies are increasingly optimistic about a soft economic landing. Most Read from BloombergLargest US Grid Declares Emergency Alert For July 27BOJ Sends Yields Soaring With Surprise Change to Rate LimitSubway Offers Free Sandwiches That Come With a Lifetime CommitmentChina’s Push to Expand BRICS Membership Falters‘Goldilocks’ Data Power Stock Gains as",https://finnhub.io/api/news?id=d1f120d19fd214005426cc7775885a768b9600281fcbf3c15b62d1faa45d9b57
2023-07-28 13:05:00,1 Monster Metaverse Stock to Buy for the Long Haul,Yahoo,"Meta Platforms is one of the most successful businesses ever, and should be a top stock pick for metaverse believers.",https://finnhub.io/api/news?id=82fa9747a357a536ad954b846cbc996f74ea7eb4d5b1d50fb404337460803d93
2023-07-28 12:38:21,"Dow Jones Futures Rise, Techs Lead Market Rebound As Inflation Cools; 5 Earnings Winners",Yahoo,"Futures signaled a market rebound, with key inflation data cooling. First Solar and Intel were big premarket earnings winners.",https://finnhub.io/api/news?id=2f55bf68ec22ee0cec6232009b8b182ca3f6384e518351f4213901c51d778033
2023-07-28 12:52:00,"Stocks Surge, Tech Rallies On Strong Earnings, Inflation Softens: What's Driving Markets Friday?",Benzinga,Looking for stock market analysis and research with proves results? Zacks.com offers in-depth financial research with over 30years of proven results.,https://finnhub.io/api/news?id=19dac16b648c2d17661994e1a8a3c01d8436f6a82e544d4fb65f50b3f324701b
2023-07-28 12:46:00,WhatsApp's Next Leap: Quick Video Messaging — Here's How To Use It,Benzinga,Looking for stock market analysis and research with proves results? Zacks.com offers in-depth financial research with over 30years of proven results.,https://finnhub.io/api/news?id=38143a6b6f119440bcc04a8e646559c14174f4a86147ecfe865225e5014747ce
2023-07-28 12:40:00,What's Going On With Microsoft Stock Friday?,Benzinga,Looking for stock market analysis and research with proves results? Zacks.com offers in-depth financial research with over 30years of proven results.,https://finnhub.io/api/news?id=65b36b192d8f0808a3b172d37251b8b1317cf0b8a3ac6e39ee52f1ca8fcece8b
2023-07-28 12:30:00,Giverny Capital Asset Management Q2 2023 Letter,SeekingAlpha,"For the second quarter of 2023, Giverny Capital Asset Managementâs model portfolio rose 7.92%, net of fees. Click here to read the full fund letter.",https://finnhub.io/api/news?id=6d517bc532fdc16edf96d521f86d3a6bdc157a3b7f1e490a213283bfa6eacd31
2023-07-28 12:28:11,Malaysia reverses plan to take legal action against Meta over harmful content,Yahoo,"Malaysia may not go through with a plan to take legal action against Facebook parent Meta Platforms following ""positive"" engagement with the firm on tackling harmful content on the social media platform, communications minister Fahmi Fadzil said in an interview on Friday.  Last month, the Malaysian Communications and Multimedia Commission (MCMC) said it would take legal action against Meta for failing to act against ""undesirable"" content relating to race, royalty, religion, defamation, impersonation, online gambling, and scam advertisements.",https://finnhub.io/api/news?id=baac13cd6aa0868d3e1884a9de9b0e7d19ccd0b996a0005745f0e3e8e301e66b
2023-07-28 12:07:00,Meta's Stock Gets a Surprising New Price Target,Yahoo,"Meta Platforms  is a FAANG stock enjoying a renaissance this year.  After falling over 70% in 2022 through last fall, Meta's shares have skyrocketed 250% since November's low.  Given the company's heavy reliance on economically-sensitive ad revenue, the resurgence in Meta's stock likely has shareholders scratching their heads.",https://finnhub.io/api/news?id=cea58eb92aa3745ed9f4da98bfd01eec3db48413172183bc00c606ba7ab88551
2023-07-28 12:00:36,Mark Zuckerberg Snatches Prized Bragging Right From Warren Buffett,Yahoo,Mark Zuckerberg may taunt Elon Musk with a cage match. But he just toppled Warren Buffett for financial bragging rights much more valuable to S&P 500 investors.,https://finnhub.io/api/news?id=2b46cd6726c7fb3911da46a99d5b88f95f54656ba11896f488b54a396f02e3d8
2023-07-28 11:58:00,LONDON MARKET CLOSE: FTSE 100 flat as DAX surges to record high,Alliance News,Looking for stock market analysis and research with proves results? Zacks.com offers in-depth financial research with over 30years of proven results.,https://finnhub.io/api/news?id=a815e7320585cd49148ddd94a346a5b64a7ccdd63400399c7f6dfe8a5a74e457
2023-07-28 11:53:13,"Meta Platforms: Good Earnings, Great Company, Time To Sell",SeekingAlpha,Meta Platforms earnings were great and the stock rallied 6%. There's a lot to be excited about when it comes to growth. But learn why I rate META stock a Sell.,https://finnhub.io/api/news?id=7df7003c567c752223e87f5c8ac55abad07d8aefc73dfa5fba70ebfa5b686088
2023-07-28 11:40:00,"Is Elon Musk's Success A Result Of Deception? Facebook Co-Founder Challenges True Impact Of Tesla, SpaceX",Benzinga,Looking for stock market analysis and research with proves results? Zacks.com offers in-depth financial research with over 30years of proven results.,https://finnhub.io/api/news?id=595d76e9847706b9da8817759466df58d53aa337e9ab5bd41457301bb152658d
2023-07-28 11:34:05,China Renaissance Upgrades Meta Platforms Inc - (META),Fintel,,https://finnhub.io/api/news?id=0926640a3418b44817d35cb81ac80efe09bcbf1d27a4563162b9e9ef7ab78659
2023-07-28 11:33:00,Meta Platforms Inc: A High-Performing Giant in the Interactive Media Industry,GuruFocus,Looking for stock market analysis and research with proves results? Zacks.com offers in-depth financial research with over 30years of proven results.,https://finnhub.io/api/news?id=b73d1d4200c84f7a377c646b2aa2162b14728338f7f7f043c572ac9bc0f04f83
2023-07-28 11:32:00,Alphabet Inc. (GOOGL) Tops the Charts with a Perfect GF Score of 100,GuruFocus,Looking for stock market analysis and research with proves results? Zacks.com offers in-depth financial research with over 30years of proven results.,https://finnhub.io/api/news?id=2b86e31af25c54d1bbaa2818668f4bf98c6ce41cb0b0912ec1326c0200f162bb
2023-07-28 11:01:00,Here’s how long the stock market rally may last,MarketWatch,Looking for stock market analysis and research with proves results? Zacks.com offers in-depth financial research with over 30years of proven results.,https://finnhub.io/api/news?id=d985feb0b3f896dac52bc1dd18b8b05e9264bd2fab740a9e2db02e1d07809457
2023-07-28 11:00:00,Avi Gilburt Warns Of Potential Banking Crisis; Charts Indicate Major Disruptions,SeekingAlpha,"Avi Gilburt runs The Market Pinball Wizard. We discuss Elliot Wave analysis, potential banking crisis and why charts indicate major market disruptions.",https://finnhub.io/api/news?id=28bcddb8ea6677a0d5bc6e6e0329a02c008960aa3a5f6609a6d43bc75ed28070
2023-07-28 11:00:00,RPT-Meta plans retention 'hooks' for Threads as more than half of users leave app,Yahoo,"Meta Platforms executives are heavily focused on boosting retention on their new Twitter rival Threads, after the app lost more than half of its users in the weeks following its buzzy launch, CEO Mark Zuckerberg told employees on Thursday.  Retention of users on the text-based app was better than executives had expected, though it was ""not perfect,"" said Zuckerberg, speaking at an internal company town hall, the audio of which was heard by Reuters.  Zuckerberg said he considered the drop-off ""normal"" and expected retention to grow as the company adds more features to the app, including a desktop version and search functionality.",https://finnhub.io/api/news?id=3c4f52b27de160dece3bd92b20c315416e94c7a6ebdb47b03f3028fbd0234b4b
2023-07-28 10:36:00,Meta Platforms (META): A Modestly Undervalued Gem in the Interactive Media Industry,GuruFocus,Looking for stock market analysis and research with proves results? Zacks.com offers in-depth financial research with over 30years of proven results.,https://finnhub.io/api/news?id=0456326582622a96deba6329a793323c978e21022440b826d082375d3d6067ac
2023-07-28 10:00:00,"Aggressive Momo Buying On BOJ Action, Bearish Technical Pattern, Consumers Splurge",Benzinga,Looking for stock market analysis and research with proves results? Zacks.com offers in-depth financial research with over 30years of proven results.,https://finnhub.io/api/news?id=b9165a9cf614c72871b1a3462432d3c5940ddae4468c9032efb8a11bcf4f5331
2023-07-28 09:30:00,"Facebook Bowed to White House Pressure, Removed Covid Posts",Yahoo,Internal Meta emails say pressure from Washington was behind a decision to take down posts attributing the pandemic to a man-made virus.,https://finnhub.io/api/news?id=b1edd67c234d23d775b0ae1b1f4b8cd6be54b76b8a587dcde88ba31ba5aa25ad
2023-07-28 09:26:00,"iPhone US Shipments Take A Hit, Does Social Media Algorithm Impact Political Beliefs? Research Reveals Answer, Disney Joins Netflix To Crack Down Password Sharing In India: Today's Top Stories",Benzinga,Looking for stock market analysis and research with proves results? Zacks.com offers in-depth financial research with over 30years of proven results.,https://finnhub.io/api/news?id=0ee4f50d4dec1868e73b807a6c3ab2dc8b359a1cc9fe896ffa01cfb5bf5c2244
2023-07-28 09:25:00,Qualcomm and Meta Team Up on AI -- 1 of These Is an AI Sleeper Stock,Yahoo,Qualcomm just announced its latest breakthroughs in bringing AI out of the cloud and to a device near you.,https://finnhub.io/api/news?id=b99cc32d7629ac81f6cca4af1c35f6a2c3814bc972bc98990ffcadef17184175
2023-07-28 08:57:00,Does Social Media Algorithm Impact Political Beliefs? Research Finds Limited Impact,Benzinga,Looking for stock market analysis and research with proves results? Zacks.com offers in-depth financial research with over 30years of proven results.,https://finnhub.io/api/news?id=17d0ab1678fdcf9dc67ac8b45dbab7263970edb2ace618713148c0923fad1720
2023-07-28 08:13:00,GLOBAL BROKER RATINGS: Oddo BHF cuts Volkswagen prefs to 'neutral',Alliance News,Looking for stock market analysis and research with proves results? Zacks.com offers in-depth financial research with over 30years of proven results.,https://finnhub.io/api/news?id=7eed35c7ac1dab4dfd9a034962c6e14987f1f9a52f238c8707b5b1d6dfd2d8ea
2023-07-28 08:07:00,"Friday’s Top Analyst Upgrades and Downgrades: Apple, Boeing, Carvana, Coty, Meta, RTX, Southwest Airlines, SunPower and More",247WallSt,Looking for stock market analysis and research with proves results? Zacks.com offers in-depth financial research with over 30years of proven results.,https://finnhub.io/api/news?id=9f823be23714d991f2a83eac78ef1cbb46df3eeb29fe9003bc1e98176e39c605
2023-07-28 08:03:00,META Plans Retention ‘Hooks’ for Threads,TipRanks,Looking for stock market analysis and research with proves results? Zacks.com offers in-depth financial research with over 30years of proven results.,https://finnhub.io/api/news?id=59288d6becc18a49b8dba1a55260d7e2b65767ea7286ca1c2c610c33809cb7a3
2023-07-28 07:52:00,Meta Attracts Big Bullish Bets From Options Traders After Strong Q2 Earnings,Benzinga,Looking for stock market analysis and research with proves results? Zacks.com offers in-depth financial research with over 30years of proven results.,https://finnhub.io/api/news?id=deda0dc6db8697a3d945c1f6f1414b1ccdd4f8fb9bb3922e5b836daf1790be19
2023-07-28 07:30:24,Don’t Be Fooled by the Stock Market’s Summer Doldrums,Yahoo,"U.S. stocks have slumped into one of the calmest periods of the past two years. Things are more explosive under the surface. The S&P 500 just notched its 18th consecutive day with a move of less than 1%, the longest streak since Nov.",https://finnhub.io/api/news?id=f9b28c696af71606b61ebe23fca1019cd38cd833fbdadbab987d66bb0bab9743
2023-07-28 07:07:00,"Digital advertising is Meta and Google’s world, and everyone else is coping with it",MarketWatch,Looking for stock market analysis and research with proves results? Zacks.com offers in-depth financial research with over 30years of proven results.,https://finnhub.io/api/news?id=372c184041dcfffd89ffe35210cb26a931102bccc75c738e97ed7df9b5539b74
2023-07-28 06:55:00,"Twitter Rival Threads Struggles To Keep Users Hooked, But Is Zuckerberg Using It Himself?",Benzinga,Looking for stock market analysis and research with proves results? Zacks.com offers in-depth financial research with over 30years of proven results.,https://finnhub.io/api/news?id=e46e6b9eff91226fd989a6028b8f1633d9a1613362130a3d56a4f8d07fe4f920
2023-07-28 06:42:00,What's Going On With Alibaba Stock Friday?,Benzinga,Looking for stock market analysis and research with proves results? Zacks.com offers in-depth financial research with over 30years of proven results.,https://finnhub.io/api/news?id=7ff13d62f34c7298b83049ec4ba855f96029656c85561cc37403fdd2772d40d7
2023-07-28 06:36:00,Meta Platforms Reaches Analyst Target Price,ETF Channel,Looking for stock market analysis and research with proves results? Zacks.com offers in-depth financial research with over 30years of proven results.,https://finnhub.io/api/news?id=e29de4f136817b9f0f76ef710e88a950a120c163e470c99036c8bb6a538537ae
2023-07-28 06:10:06,YouGov hires former Facebook exec as CEO; profit to be as expected,Finnhub,"YouGov PLC on Friday announced a series of executive changes, including moving its chief executive officer to non-executive chair, while noting strong underlying revenue growth and profit in line with...",https://finnhub.io/api/news?id=925061bf711990de4d9373b73020258198dbb5f0788a5d97f6cf6f20aff80811
2023-07-28 06:02:00,Meta Platforms upgraded to Buy from Hold at China Renaissance,Thefly.com,Looking for stock market analysis and research with proves results? Zacks.com offers in-depth financial research with over 30years of proven results.,https://finnhub.io/api/news?id=9ce0c8267efee6690055b954e739863b1a416d0414d834884430e87569463f69
2023-07-28 06:01:00,US Stock Futures Signal Rebound On Tech Earnings Support: Analyst Tells Why Fed May Not Start Cutting Rates Anytime Soon,Benzinga,Looking for stock market analysis and research with proves results? Zacks.com offers in-depth financial research with over 30years of proven results.,https://finnhub.io/api/news?id=ab4056182b0bcf6466390fd4583d696c18282549b148fe77932e430c97e4ea4a
2023-07-28 05:43:00,Meta said to plan features to boost retention at Threads as more than half users quit,Seeking Alpha,Looking for stock market analysis and research with proves results? Zacks.com offers in-depth financial research with over 30years of proven results.,https://finnhub.io/api/news?id=d1d3e81f4b10f379e154b15da86a4d06379fc44858353ca04bf76d632686b666
2023-07-28 05:37:00,Is QYLD ETF’s 11.3% Dividend a High-Yield Trap?,TipRanks,Looking for stock market analysis and research with proves results? Zacks.com offers in-depth financial research with over 30years of proven results.,https://finnhub.io/api/news?id=f68a78b6e945773d615d1d2f73c6ec0ea52eadab1d4701f0465f36bb50916c21
2023-07-28 05:30:00,The Bank Of Japan Is Taking The First Small Step Towards Normalizing Monetary Policy,TalkMarkets,Looking for stock market analysis and research with proves results? Zacks.com offers in-depth financial research with over 30years of proven results.,https://finnhub.io/api/news?id=06d3f1f81121cf91c192ae2f0d95ab84ea1d4007132bc88d72e9320dc5c29bd7
2023-07-28 05:15:20,4 big analyst picks: Meta notches several upgrades on strong Q2 Performance,Yahoo,"Here is your Pro Recap of the biggest analyst picks you may have missed since yesterday: upgrades at Meta Platforms, Boeing, Block, and Crocs.  Meta Platforms (NASDAQ:META) shares gained more than 4% yesterday after the company reported strong Q2 earnings and outlook, leading to several upgrades.  Wells Fargo upgraded the company to Overweight from Equal Weight and raised its price target to $389.00 from $313.00.",https://finnhub.io/api/news?id=9f1ab32a74f3892cd8b311add6708180b4c41a11b27bd8c49c70d7df6c04ce76
2023-07-28 05:11:24,"5 big earnings hits: Meta delights, Microsoft warns in huge week for tech, AI",Yahoo,"Investing.com -- Here is your Pro Recap of the biggest earnings reports you may have missed this week and what Wall Street analysts have to say: Numbers out of Meta, Alphabet, Microsoft, Boeing, and McDonald's.",https://finnhub.io/api/news?id=0e892e273d7715a7b1ac1938f00e5156e044f953d087ad51ea8ba679e54f1f28
2023-07-28 05:09:00,"Meta focuses on boosting retention rates on Threads, Reuters reports",Thefly.com,Looking for stock market analysis and research with proves results? Zacks.com offers in-depth financial research with over 30years of proven results.,https://finnhub.io/api/news?id=7eb102f2af5e1fef88a5de4d919a05633f1fa5d14bf864fdb336822b2313488d
2023-07-28 05:08:00,"Facebook removed COVID-19 posts due to pressure from White House, WSJ reports",Thefly.com,Looking for stock market analysis and research with proves results? Zacks.com offers in-depth financial research with over 30years of proven results.,https://finnhub.io/api/news?id=5edec28725e8b610c1ec8fde9c417cdcc011ec9b7548bf0ced7d377f219483d3
2023-07-28 05:00:00,'Magnificent 7' Rally Sheds Light On The Need For Capped Indexes,SeekingAlpha,"The Technology industry surged in 2023, led by the dominant tech giants known as the ",https://finnhub.io/api/news?id=be883fcf9dc50df98da46c4d005914eb592afe051e1afd24b3528d4d47f38f0d
2023-07-28 04:43:00,"Facebook's algorithm 'influencial,' doesn't change beliefs, NYT reports",Thefly.com,Looking for stock market analysis and research with proves results? Zacks.com offers in-depth financial research with over 30years of proven results.,https://finnhub.io/api/news?id=79d4d7d284ead1d946be0d6015a4d58df199d6d47a13abbb45b5b47a6327ad76
2023-07-28 04:36:00,"Meta Platforms Inc. stock rises Friday, outperforms market",MarketWatch,Looking for stock market analysis and research with proves results? Zacks.com offers in-depth financial research with over 30years of proven results.,https://finnhub.io/api/news?id=39480b8507d5b9aa96c19689756ca0c7017c514e06f23c3b19962399684dd2e8
2023-07-28 03:43:00,"Friday Sector Leaders: Services, Energy",Market News Video,Looking for stock market analysis and research with proves results? Zacks.com offers in-depth financial research with over 30years of proven results.,https://finnhub.io/api/news?id=1c89da2448f4e7286d93d28ed8dfdf9b44358174bd74a182a87b0e9b40506220
2023-07-28 03:37:00,What You Missed On Wall Street On Friday,Thefly.com,Looking for stock market analysis and research with proves results? Zacks.com offers in-depth financial research with over 30years of proven results.,https://finnhub.io/api/news?id=a08eecb3eb8ca1b2a8039da1b7f73bec5bd611cb5fbaf18178c80a4b5d512519
2023-07-28 03:32:00,Meta Platforms Inc. stock outperforms competitors on strong trading day,MarketWatch,Looking for stock market analysis and research with proves results? Zacks.com offers in-depth financial research with over 30years of proven results.,https://finnhub.io/api/news?id=410e4c66464fd64deec70f0eb9d6352abea2b8f89e7f18f09cc887c4fcb5d050
2023-07-28 03:31:00,Four of the “Magnificent Seven” Report Earnings – Here’s What They Say About AI,InvestorPlace,Looking for stock market analysis and research with proves results? Zacks.com offers in-depth financial research with over 30years of proven results.,https://finnhub.io/api/news?id=4624ed08bfe1fd43ff764861b3cbadb284f1386e43ec82127927054731bfd308
2023-07-28 03:30:00,Passive Investing Is More 'Active' Than Meets The Eye,SeekingAlpha,Index providers make ongoing decisions to accommodate massive asset flows into passive vehicles. Case in point: the recent reshuffling of the Nasdaq 100.,https://finnhub.io/api/news?id=beeb7c342c11d0b3200e88683255728df652f781f871313d434c8ac4acc4c58b
2023-07-28 03:12:00,Snap (NASDAQ:SNAP) Faces an Uphill Battle Despite Strong User Growth,TipRanks,Looking for stock market analysis and research with proves results? Zacks.com offers in-depth financial research with over 30years of proven results.,https://finnhub.io/api/news?id=7d20b952e7a004d6a400bc50acb9f2a98b481f88a43dbbd74a58c32063f832cc
2023-07-28 03:11:00,"The Dow Breaks 13-Day Winning Streak, Fed Raises Interest Rates To 2001 Levels And AI Is The Buzzword For Big Tech Earnings: The Week In The Markets",Benzinga,Looking for stock market analysis and research with proves results? Zacks.com offers in-depth financial research with over 30years of proven results.,https://finnhub.io/api/news?id=b105af30e0ca4092407f2e71b07794cca664503d098f0bbd636f5368a4e8ea05
2023-07-28 02:08:00,Investor Sentiment Declines After Dow Snaps 13-Day Win Streak,Benzinga,Looking for stock market analysis and research with proves results? Zacks.com offers in-depth financial research with over 30years of proven results.,https://finnhub.io/api/news?id=ef9113b30a6719691c4b8fdd920fc8603cfa799aa919e2d96a8cbd8c3f53928c
2023-07-28 01:34:09,Meta plans retention 'hooks' for Threads as more than half of users leave app,Yahoo,"Meta Platforms executives are heavily focused on boosting retention on their new Twitter rival Threads, after the app lost more than half of its users in the weeks following its buzzy launch, CEO Mark Zuckerberg told employees on Thursday.  Retention of users on the text-based app was better than executives had expected, though it was ""not perfect,"" said Zuckerberg, speaking at an internal company town hall, the audio of which was heard by Reuters.  Zuckerberg said he considered the drop-off ""normal"" and expected retention to grow as the company adds more features to the app, including a desktop version and search functionality.",https://finnhub.io/api/news?id=5abc208a7a462a60e01a5b5a33c1fa4969b59f81e141ebc657f2417ced246948
2023-07-28 01:31:00,Buy/Sell: Wall Street's top 10 stock calls this week,Thefly.com,Looking for stock market analysis and research with proves results? Zacks.com offers in-depth financial research with over 30years of proven results.,https://finnhub.io/api/news?id=180dbdeeb48ada025ac24cc38c5a934f772a349a79760f462f8959f8af448636
2023-07-28 01:16:00,"Pinterest likely to show user growth, better execution amid 'more stable' ad market",Seeking Alpha,Looking for stock market analysis and research with proves results? Zacks.com offers in-depth financial research with over 30years of proven results.,https://finnhub.io/api/news?id=84854e8639aeec13684e4b5ab2a7e43a9e4ffd5d50ecc7ab8d2aeae314a9a1dc
2023-07-27 23:08:37,Truist Securities Maintains Meta Platforms Inc - (META) Buy Recommendation,Fintel,,https://finnhub.io/api/news?id=5a2d2ea6a6846b5f3e662f7b9978ab8a42dcf1b0cc8483b45e97f2fda65c350c
2023-07-27 23:08:12,HSBC Upgrades Meta Platforms Inc - (META),Fintel,,https://finnhub.io/api/news?id=0bfb2ad118861d0b75f8ccd7d01dc13b5d962e7ddf4b24a143385ee7e232c475
2023-07-27 23:08:12,RBC Capital Maintains Meta Platforms Inc - (META) Outperform Recommendation,Fintel,,https://finnhub.io/api/news?id=785b543d11002818d9a0557fa84fcbacfa3680441a941c5243db447f1516af41
2023-07-27 23:08:12,Guggenheim Maintains Meta Platforms Inc - (META) Buy Recommendation,Fintel,,https://finnhub.io/api/news?id=1bd1e010b9cb5029c6343b817add1226a5e8968de817e2ab5bf29b919d0d1979
2023-07-27 23:00:00,Is This The Best Way To Play The $700 Billion EV Boom?,Yahoo,"The EV market has become extremely competitive in 2023, and while some of the smaller players are getting crushed, smart investors are betting on highly profitable niches such as electric boats",https://finnhub.io/api/news?id=4fd5459c2049a3921410c6cc3277f77628886472e04977d8b8a07476b41c50cf
2023-07-27 22:02:38,"Threads can become the ‘purest form’ of social media as long as Meta and Mark Zuckerberg agree to one thing, says tech exec",Yahoo,The president of a once-trendy social app believes Meta should operate Threads as a loss leader to help it reclaim the goodwill it lost over the past few years.,https://finnhub.io/api/news?id=14260d012c265cf5a19780b2325b2068dcf80fda9b9933132a9346519a2368f1
2023-07-27 21:59:55,"Meta's Reels revenue narrows in on TikTok, boosted by AI",Yahoo,"Reels, Meta Platforms' answer to viral short-form video app TikTok, elicited eyerolls when it launched in 2020 and was regarded as yet another example of Meta copying a popular rival.  But on Wednesday, Meta revealed numbers that show Reels videos are growing rapidly among both users and advertisers and are quickly catching up to the ByteDance-owned TikTok app that is beloved by young users and has reshaped the social media landscape.  Meta says the rags-to-riches growth of Reels, which are viewable on both Facebook and Instagram, speaks in part to the company's improving recommendation software, long the Chinese-owned rival's strong point.",https://finnhub.io/api/news?id=7d9a6bc21af52795d97e55ee36fd46e0bef8e62edc53020330261c89b9fd8029
2023-07-27 21:55:28,Why Few Investors Were Excited About Alphabet Stock Today,Yahoo,"Thursday was generally a good day for tech stocks, but you wouldn't infer that purely from Alphabet's (NASDAQ: GOOG) (NASDAQ: GOOGL) performance.  Investors seemed concerned by the news that its self-driving technology unit is pulling back on efforts to develop an autonomous semi-truck.  While other top tech titles were enjoying a lift provided by Meta Platforms' strong quarterly results, both listed Alphabet stocks basically only traded flat on the day.",https://finnhub.io/api/news?id=28b4dc909fd57707298aa58218fe0e311b44ac37b7a3a59dc2642053ab432d51
