datetime,headline,source,summary,url
2023-07-27 21:22:00,7 Things You May Have Missed From Meta's Earnings,Yahoo,"Meta Platforms  stock has been on a roller coaster ride.  Founder and CEO Mark Zuckerberg's pivot to the metaverse cost it billions in expenses, while ad revenue got hamstrung by recessionary worry.  Meta Platforms' shares have surged nearly 260% since last November's low.",https://finnhub.io/api/news?id=a2f4ba4c69e05913f0cd8496f1056edcbb8c2781d42b009bcd4251b1e12f4ef3
2023-07-27 21:14:00,Dow’s Winning Streak Comes to an End,Yahoo,"The Dow Jones Industrial Average fell Thursday, ending a streak of 13 consecutive winning sessions that was the second longest on record.",https://finnhub.io/api/news?id=11d96c994e5de795ce020717d7d330a4d9510b090936a0170ca323dc25cb71b7
2023-07-27 20:26:48,"Fed's messaging has been consistent, but market isn't listening: Strategist",Yahoo,"The Federal Reserve raised rates by 25 basis points at its July meeting as part of its ongoing battle against inflation. Aptus Capital Advisors Portfolio Manager David Wagner notes that while the Fed has left the door open to future rate hikes, the market is signaling that it wants a rate cut. Wagner explains that the Fed has been transparent in its messaging, ""it's unfortunate that the market doesn't believe that.""",https://finnhub.io/api/news?id=186f4aac575ca59980dd79e06ac6642db77856719b7b84483201646eb704115b
2023-07-27 20:18:00,"These Stocks Moved the Most Today: Meta, Chipotle, Southwest, Royal Caribbean, QuantumScape, Align, and More",Yahoo,"Meta Platforms reported better-than-expected second-quarter earnings and third-quarter revenue guidance, Chipotle's revenue missed estimates, Southwest expects a revenue decline in the third quarter, and Royal Caribbean posted a blowout quarter.",https://finnhub.io/api/news?id=5abb82ba4d23417f8be74ccbb9e627389d10df460fe9ceb60b2f4189ba52d37a
2023-07-27 20:16:39,"Meta a 'faster, nimbler' company after cost cuts, CFO says",Yahoo,"Shares of Meta Platforms (META) jumped after the social media company reported second quarter earnings that topped analyst estimates and issued rosy third quarter guidance. In an interview with Yahoo Finance Live, Meta CFO Susan Li cited a few different reasons for why revenue was so strong. First was favorable comparisons to the prior year. Second is that Meta is seeing ""stabilization in the broader macroeconomic landscape,"" specifically in some of the areas the company has more exposure to, such as retail and gaming, Li said. Finally, Li credits some of Meta's long-term investments with helping to grow revenue.  On the cost side, Li says the company's ""year of efficiency"" has set the company up ""to be in a good place from a cost structure perspective"" and that, as a result, Meta is a ""faster, nimbler company."" When it comes to its newest product, Threads, Li says the company is ""pleased"" with its user growth so far, but it's still too soon to discuss monetization.  One of Meta's big investments has been Reality Labs, the unit working on its augmented and virtual reality products. Li says they have a ""very long term time horizon"" for when those investments start to show returns.",https://finnhub.io/api/news?id=b3f16d0e03c057bfe1dd3b5d2056fb129b962cdada1694af7d84d524947b883e
2023-07-27 20:13:32,Stock Market Today: Stocks Drop Despite Solid Meta Earnings,Yahoo,"The major benchmarks couldn't hold on for a win Thursday, though Meta stock popped on impressive Q2 results. Stocks started the day higher, as market participants brushed off concerns that the Federal Reserve might not be done raising interest rates and instead focused on strong earnings from Facebook parent Meta Platforms (META). Investor sentiment also got a boost early on after a round of solid economic data eased recession worries. However, the optimism faded as the session wore on, with the",https://finnhub.io/api/news?id=664af53a9595da04db0b30dc4cfbdce9e260bc1ceffdc457262c265f61f8d00b
2023-07-27 19:53:00,Does Facebook Polarize Users? Meta Disagrees With Partners Over Research Conclusions,Yahoo,The company and researchers differ regarding how to interpret the findings from studies of the 2020 presidential election.,https://finnhub.io/api/news?id=402cac8efe68bc9a65aa0b6a9e3c75e6c0e6cb569ef208583d667a1da9251ac5
2023-07-27 19:49:08,Meta's Comeback Gains Traction,Yahoo,The company remains fairly valued despite a major rally this year,https://finnhub.io/api/news?id=32a39dde2173fd8c510f37d33b215ab419025b7b21e0e3e3370fe335d7869b68
2023-07-27 19:39:05,GF Score Analysis: Meta Platforms Inc (META),Yahoo,"Meta Platforms Inc (NASDAQ:META), formerly known as Facebook Inc, is a leading player in the interactive media industry.  In this article, we will delve into the company's GF Score of 92 out of 100, which indicates a high outperformance potential.  The GF Score is a comprehensive stock performance ranking system developed by GuruFocus, which evaluates a company's financial strength, profitability, growth, GF value, and momentum.",https://finnhub.io/api/news?id=19c6862e6e8774361a49dd360c80485a56dcfa7c4ad1712bf7acb9c0dd65fcaa
2023-07-27 19:14:16,New research on Facebook shows the algorithm isn't entirely to blame for political polarization,CNBC,Researchers working with Meta published four new studies that detail a nuanced view of polarization on Facebook and Instagram.,https://finnhub.io/api/news?id=d1a27cf3fb09027b5c6149dd91d1c893c66a71bbd28b668801c90ea6aada3187
2023-07-27 18:54:41,"Despite a down day for the Dow, Cramer sees a lasting positive change in the market ",CNBC,CNBC's Jim Cramer on Thursday told investors he thinks the current market looks more like it did in the 80s and 90s before the dotcom burst.,https://finnhub.io/api/news?id=29f0200407f635bf9526b68c15864585f4a60605624f4bbaddf6aa1651577a2d
2023-07-27 18:43:24,Meta's stock rally hasn't been about the metaverse at all,Yahoo,"Meta's stock is up more than 150% this year despite mounting losses at its metaverse-focused bet, Reality Labs.",https://finnhub.io/api/news?id=67ed435a5ae989c1bb1e5f35c698bfc5a8e3ad08cbab891a9635a5b992a7cb56
2023-07-27 18:40:16,Meta Has a Rare Opportunity to Seize Momentum With Threads,Yahoo,"(Bloomberg) -- Mark Zuckerberg’s Meta Platforms Inc. is incredibly good at making money from other peoples’ ideas — see Instagram and Reels. There’s every reason to think it can do the same with Threads, the Twitter-like app the social network launched earlier this month.Most Read from BloombergSubway Offers Free Sandwiches That Come With a Lifetime CommitmentLargest US Grid Declares Emergency Alert For July 27Fed Raises Interest Rates to 22-Year High, Leaves Door Open for MoreUS 10-Year Yield H",https://finnhub.io/api/news?id=bacd8c0950af05cead5706c88a1dd95fb54147a3a12a22ab78641661b8dd2a35
2023-07-27 18:14:13,Why Meta Platforms Stock Was Gaining This Week,Yahoo,"Shares of Meta Platforms (NASDAQ: META) were moving higher this week after the company posted better-than-expected results in its third-quarter earnings report and also seemed to benefit from a strong report at rival Alphabet.  After several quarters of weak results, Meta posted solid acceleration in revenue growth in the second quarter with the top line up 11% to $32 billion, beating analyst estimates at $31.1 billion.  Advertising revenue rose 12% to $31.5 billion as the company saw a 34% increase in ad impressions but a 16% decline in price per ad.",https://finnhub.io/api/news?id=04d4574cf6e4521346b669b16edbbe4319e096b71c4e841e23d7c3a3f9bddb24
2023-07-27 18:08:25,"Facebook False News in US Election Reached More Conservatives, Study Says",Yahoo,"(Bloomberg) -- Researchers observed conservatives engaging more with false news stories on Facebook than liberals during the US 2020 presidential election, according to a new study published Thursday in the academic journal Science — one of the first revelations in a massive research project to understand Facebook’s impact on democracy.Most Read from BloombergSubway Offers Free Sandwiches That Come With a Lifetime CommitmentLargest US Grid Declares Emergency Alert For July 27Fed Raises Interest",https://finnhub.io/api/news?id=e2247c835d4be176b72fcaadcb1cd18b7715fcf30a64556dff82715e56712df0
2023-07-27 18:00:36,Deep dive into Meta's algorithms shows that America's political polarization has no easy fix,Yahoo,"The powerful algorithms used by Facebook and Instagram to deliver content to users have increasingly been blamed for amplifying misinformation and political polarization.  The four research papers, published in Science and Nature, also reveal the extent of political echo chambers on Facebook, where conservatives and liberals rely on divergent sources of information, interact with opposing groups and consume distinctly different amounts of misinformation.",https://finnhub.io/api/news?id=9e2a84535c43865542db8b5c421811177831f01d412aeca7ac36f2c9d8eeb876
2023-07-27 17:55:17,Overlooked Factors of Meta's Earnings,Yahoo,"The company's 2nd-quarter results impressed, but valuation risks are evident",https://finnhub.io/api/news?id=cb76d110be62ee71be27ad2869c68b801afdc365696acc62b55b16de73dcec02
