datetime,headline,source,summary,url
2023-08-01 22:24:00,Meta Platforms Begins Blocking News for Canadian Users,Yahoo,The Facebook parent says the changes—in response to parliamentary legislation aimed at compensating domestic media—will take weeks to roll out.,https://finnhub.io/api/news?id=0d114d54d3dc33148097ce4cae628cc37446825c003a0d34641c5a05b55d70ca
2023-08-01 21:22:57,"TikTok, Reels, YouTube Shorts: Short-form video is 'attracting a lot of ad dollars,' says DoubleVerify CEO",Yahoo,"Shares of digital advertising company DoubleVerify tumbled 14 percent despite reporting revenue that was in-line with forecasts and reaffirming its guidance. DoubleVerify CEO Mark Zagorski tells Yahoo Finance Live that in the advertising space ""social continues to grow"" much of it ""driven by short-form video."" Social media platforms like TikTok and YouTube Shorts are ""really driving a lot of customer engagement and attracting a lot of ad dollars as well.""",https://finnhub.io/api/news?id=8dde3dc7844631bdc5a8091a7395f9c6eed5ee03e8c40c5af782bd7a3a9d0461
2023-08-01 20:00:47,Meta Platforms: Back To Bad Habits,SeekingAlpha,"Meta Platforms plans to ramp up spending on Reality Labs, potentially impacting efficiency goals. Click here to read why we are still bullish on META stock.",https://finnhub.io/api/news?id=837cf0e95ec45cfcae2fab4e24dd4fd3711eed81820cea344e1c55deb917e017
2023-08-01 18:13:59,Meta Platforms: We're Only At Halftime,SeekingAlpha,"Consistent with our expectations, Metaâs 2Q23 results confirmed it is on track for revenue acceleration and improving margins. Learn more about META stock here.",https://finnhub.io/api/news?id=346f4ba3b829bfbe35ce6434545e62eb3be2f7920a84d50e41298873b07e39e4
2023-08-01 17:05:01,AI hype boomed to start 2023. Earnings reveal gains won't appear 'overnight',Yahoo,"After half a year of artificial intelligence exuberance, companies are warning the impacts from the new technologies aren't dominating profits yet. And investors are being more cautious with these stories.",https://finnhub.io/api/news?id=bdb02a934db18dd311b37fc6cc2d34049cf51fc023755941c70e49cc7f4361e0
2023-08-01 16:59:10,Meta and Google plan to make generative A.I. an inescapable part of your life,Yahoo,"Ready or not, here come the A.I. bots.",https://finnhub.io/api/news?id=0bf448a1204fb46e12c45711ef665a3700ec379f8fcff17632c495c4024addf7
2023-08-01 16:54:17,UPDATE 3-Meta starts blocking news in Canada over law on paying publishers,Yahoo,"Meta Platforms has begun the process to end access to news on Facebook and Instagram for all users in Canada, it said on Tuesday, in response to law requiring internet giants to pay news publishers.  The Canadian government quickly denounced the move as ""irresponsible,"" and said the world is watching the process play out in Canada.  The Online News Act, passed by the Canadian parliament, would force platforms like Google parent Alphabet and Meta to negotiate commercial deals with Canadian news publishers for their content.",https://finnhub.io/api/news?id=4955ea8350d1bc6d3115290b1d75f08e8f5679752eb5d03a29f231f4b1fb985e
2023-08-01 16:13:00,X marks the lawsuit: Elon Musk's social media company sues nonprofit highlighting site's hate speech,"Associated Press, The",Looking for stock market analysis and research with proves results? Zacks.com offers in-depth financial research with over 30years of proven results.,https://finnhub.io/api/news?id=0a137dea623b12d9784c63788ce4144dc85e2661e49f30348024295da827aedf
2023-08-01 15:50:17,Nasdaq Rebalance: What You Need To Know,SeekingAlpha,"The NASDAQ recorded its strongest six-month performance in history, driven by top tech stocks such as Apple, Microsoft, and Amazon. Click here to read more.",https://finnhub.io/api/news?id=d233316a69cc0615403df9beaf0c6aa65c5b6e30b76d3758a4d3ec0c69a43a3e
2023-08-01 14:42:56,Seeing more interest in AI than metaverse: Strategist,Yahoo,"Meta is planning to launch AI chatbots with various personalities, according to the Financial Times. Roundhill Investments Chief Strategy Officer David Mazza tells Yahoo Finance Live we’re seeing the ""near-term reality and focuses of a company like Meta on generative AI because it's a bit more attainable"" and ""usable."" Mazza also discusses Roundhill’s metaverse and generative AI ETFs and how the generative AI ETF, CHAT, ""is seeing considerably more interest right now than"" the Metaverse ETF, METV, ""from a flow perspective even as performance of both is really strong.""",https://finnhub.io/api/news?id=67fa03fc1d9ea9c78e5c85fc6834add64995805ce117f56a01c24361f2d064d7
2023-08-01 14:02:36,JMP Securities Reiterates Meta Platforms Inc - (META) Market Outperform Recommendation,Fintel,,https://finnhub.io/api/news?id=507a4413660106a9a8c92e47131b653c342ffc9929b80945034e1ebfe4094ab2
2023-08-01 13:47:05,Meta to seek user consent for targeted ads in the EU,Yahoo,"Meta intends to ask users in the European Union for their consent before allowing businesses to target advertising based on what they view on its services such as Facebook and Instagram, the social media giant said on Tuesday.  Meta said the change is to address a number of evolving regulatory requirements in the region and stems from an order in January by Ireland's Data Protection Commissioner, Meta's lead EU regulator, to reassess the legal basis on how it targets ads.",https://finnhub.io/api/news?id=66174a96907f8cc53533249f9ce2120939a4cdb8dbd1200d93cdf00082537fc5
2023-08-01 13:33:26,"Meta stock just had a monster July, and here's why August could be sizzling too",Yahoo,"Believe it or not, Meta's stock still looks cheap on this one important valuation metric.",https://finnhub.io/api/news?id=ee1011bc073431c73d107cd78df6fa7c443e7f4058ebafd641dad264a9de49d0
2023-08-01 13:16:25,Amazon employees leak secret info that marketplace sellers can buy on Telegram,CNBC,Third-party merchants who have been suspended by Amazon can pay for confidential data to potentially help them get their accounts back up and running. ,https://finnhub.io/api/news?id=b7448d56c8706010e6e162d87c15548d5529ab7c34874099a7b25c24588447de
2023-08-01 12:55:16,Meta is secretly building an AI chatbot with the personality of Abraham Lincoln,Yahoo,ChatGPT-style tool is one of 30 potential ‘personas’ that could launch on Instagram next month,https://finnhub.io/api/news?id=8deeb9e6995d5993bdac27dc1cc00e1f8d5cd8834026053942f18c61c6b73fe6
2023-08-01 12:49:51,"Twitter, now called X, sues researchers who showed rise in hate speech on platform after Musk takeover",CNBC,"On Monday, X Corp., formerly known as Twitter, filed a lawsuit against the Center for Countering Digital Hate in a federal court. ",https://finnhub.io/api/news?id=8ac6b1eef25c100cef316d69b396a8e028ed208b54e14d57da6c24d514d49e2e
2023-08-01 12:44:09,Meta starts process to end news availability in Canada,Finnhub,"Meta Platforms has begun the
process of ending news availability in Canada, the company's
spokesperson Andy Stone said.
              As we've always said, the law is based on a fundamentally
flawed...",https://finnhub.io/api/news?id=d2fadeff83c706978bb70a5482df6778e5bcf9dc6a120cbd5c1d8b2ab9f3490f
2023-08-01 12:44:00,The First Peak Week Of Earnings Season Brings Some Good News,Seeking Alpha,Looking for stock market analysis and research with proves results? Zacks.com offers in-depth financial research with over 30years of proven results.,https://finnhub.io/api/news?id=347b4a74239aae3ac72f461f4d2c1cfa3e59521946a6844437640b5e9a52103e
2023-08-01 12:42:00,Meta's Brilliant Name Change Strategy Trumped 'Facebook Papers' Scandal: A Top Executive's Revelation,Benzinga,Looking for stock market analysis and research with proves results? Zacks.com offers in-depth financial research with over 30years of proven results.,https://finnhub.io/api/news?id=314d459a6867c873d6735fcb6c82e6de1de3ba14e1f2d5d918f332205e1178fa
2023-08-01 12:39:00,10 Communication Services Stocks With Whale Alerts In Today's Session,Benzinga,Looking for stock market analysis and research with proves results? Zacks.com offers in-depth financial research with over 30years of proven results.,https://finnhub.io/api/news?id=0a61187885872a12621405f0adb6b641aaaf467673735bab329a37c5f09063f3
2023-08-01 12:29:00,4 Top-Performing Leveraged ETFs of Last Week,Yahoo,"Wall Street delivered a decent-to-upbeat performance last week, mainly on earnings strength and a strong U.S. economy.",https://finnhub.io/api/news?id=7f2f446ac19ee64d5b93024fa3a295d2e99e305993aae0cb83d59bda097d160d
2023-08-01 12:21:00,DGRO: Consistent Dividend Growth For Patient Investors,Seeking Alpha,Looking for stock market analysis and research with proves results? Zacks.com offers in-depth financial research with over 30years of proven results.,https://finnhub.io/api/news?id=d4137e7b0e3af75da1092440447f6e0fd4e4d2bfed69968456ce25cc5be23443
2023-08-01 12:10:00,Apple App Store - Top Apps,"Associated Press, The",Looking for stock market analysis and research with proves results? Zacks.com offers in-depth financial research with over 30years of proven results.,https://finnhub.io/api/news?id=779701a95ee3bb41a2f2b1377633537db28db8e5aa3aed707f467bddf351fb96
2023-08-01 12:05:00,3 Stocks That Are Fantastic Deals Right Now,Yahoo,"The Nasdaq has risen nearly 40% since the beginning of the year as investors warmed up to higher-growth tech stocks again. However, many investors might be reluctant to chase that rally as interest rates stay elevated.",https://finnhub.io/api/news?id=95c15fba542b0fac3e4be04110fd7162eaaf615afc067bc0a24a1e17b9212beb
2023-08-01 12:01:00,"Texas Senator John Cornyn Tours Tesla Gigafactory, Says Discussed 'AI, Supply Chains...SpaceX, China' With Elon Musk",Benzinga,Looking for stock market analysis and research with proves results? Zacks.com offers in-depth financial research with over 30years of proven results.,https://finnhub.io/api/news?id=6d84a92b678fd7d8b8644ff831a36e5a8f480baf5533b28e6a7df12c9ca9970b
2023-08-01 11:48:00,What You Missed On Wall Street This Morning,Thefly.com,Looking for stock market analysis and research with proves results? Zacks.com offers in-depth financial research with over 30years of proven results.,https://finnhub.io/api/news?id=6b1b2a6476db0d15b7ff54336aea87f727f531b4ba709e6010fa325c65f3741b
2023-08-01 11:40:00,Meta Offers to Seek Consent for Highly Personalized Ads in Europe,Yahoo,"Under pressure from privacy regulators, Meta Platforms has proposed asking all users in Europe to decide whether they would like to see ads targeted based on how they interact with its apps.",https://finnhub.io/api/news?id=1ae3032713488ec7cb0dbbc03ea8a7a4fa71e8dd8291813bc658c7aa026d2543
2023-08-01 11:14:38,5 Things to Know Before Markets Open,Yahoo,"Meta Platforms is planning to roll out AI chatbots to help it retain users of its apps and healthcare retailer CVS lays off 5,000 workers as it cuts costs in preparations to expand into primary care. Here’s what investors need to know today.",https://finnhub.io/api/news?id=49fdd37abb42e614dba4e8b71ff969e10126037e7538078a9f5b7f2ca0cd245b
2023-08-01 11:00:49,"At US$319, Is Meta Platforms, Inc. (NASDAQ:META) Worth Looking At Closely?",Yahoo,"Let's talk about the popular Meta Platforms, Inc. ( NASDAQ:META ). The company's shares saw a significant share price...",https://finnhub.io/api/news?id=6dbd0a5a890a6c5d52a8a9c1f894e6bd52070dd3c5f556aae2088389c5b3d279
2023-08-01 11:00:00,Companies Weigh Growing Power of Cloud Providers Amid AI Boom,Yahoo,A wave of partnerships between AI model makers and cloud providers is leading tech chiefs to assess the benefits of convenience versus becoming too reliant on any one vendor.,https://finnhub.io/api/news?id=9f65237c9c7ed9a0e8ef42cfc7d01c3a694822f69e6178268308cf5b3939e224
2023-08-01 10:45:00,Arista Networks' 2nd-Quarter Results Support Strong Momentum,GuruFocus,Looking for stock market analysis and research with proves results? Zacks.com offers in-depth financial research with over 30years of proven results.,https://finnhub.io/api/news?id=099eef22646cdcf26bf0aa7fab2a7f1ff1298e0192f664a00cceeb894803f9a9
2023-08-01 09:47:00,META Stock Price Predictions: Get Ready for Meta Platforms to Blast to an All-Time High!,InvestorPlace,Looking for stock market analysis and research with proves results? Zacks.com offers in-depth financial research with over 30years of proven results.,https://finnhub.io/api/news?id=edcee25bc41874f557416cb9c473e684d1d0c28a754b02bae954d33d7030b3a7
2023-08-01 09:35:06,UPDATE 1-Meta prepares AI-powered chatbots in attempt to retain users - FT,Yahoo,"Meta Platforms is preparing to launch a range of artificial intelligence (AI) powered chatbots that exhibit different personalities as soon as September, the Financial Times reported on Tuesday.  Meta has been designing prototypes for chatbots that can have humanlike discussions with its users, as the company attempts to boost its engagement with its social media platforms, according to the report, citing people with knowledge of the plans.  The Menlo Park, California-based social media giant is even exploring a chatbot that speaks like Abraham Lincoln and another that advises on travel options in the style of a surfer, the report added.",https://finnhub.io/api/news?id=c6870846425db396af2ce43247331f48646afa075e4db9045999c9413cdbc179
2023-08-01 09:15:00,Better Buy: Meta Platforms vs. Snap,Yahoo,"Meta's stock sank to a seven-year low of $88.09 last November, while Snap's stock closed at $7.33 -- its lowest price in nearly four years -- last October.  Snap's stock has also rallied about 40%, but its advertising revenue is still declining.",https://finnhub.io/api/news?id=4712f7e7081900946114077d69e4f923bd43447486be08efe2d1231524495e54
2023-08-01 09:11:15,Facebook plant lancering gepersonaliseerde chatbots,Finnhub,"Copyright BusinessAMBE 

De overstap naar het metaverse was tot nu toe geen succes voor Meta, het moederbedrijf van Facebook. Daarom spitst de techgigant zich nu toe op artificiële intelligentie ....",https://finnhub.io/api/news?id=5bbb0ec1324f48312b891941c3748769f97bd77e8e525b29c770f748936eb7ba
2023-08-01 08:54:00,Mark Zuckerberg's Meta Pitches User Consent For Targeted Ads To EU Regulators,Benzinga,Looking for stock market analysis and research with proves results? Zacks.com offers in-depth financial research with over 30years of proven results.,https://finnhub.io/api/news?id=1b0e645fc78445e7efe9f24c2a75f004d5e0cf23bf910c61666af75ef7c5459d
2023-08-01 07:16:38,5 things to know before the stock market opens Tuesday,CNBC,Here are the most important news items that investors need to start their trading day.,https://finnhub.io/api/news?id=42f7b850d73bbcf385e14d77d1c805106a721e8181c049ee7dde2baf0e8d9238
2023-08-01 06:45:00,Meta Platforms price target raised to $375 from $353 at Argus,Thefly.com,Looking for stock market analysis and research with proves results? Zacks.com offers in-depth financial research with over 30years of proven results.,https://finnhub.io/api/news?id=2b7ba6f103de7b12d78a4372239e9aa4b87951b9a12a5ff50015a139b69c186b
2023-08-01 06:32:00,What's Going On With Meta Platforms Stock Tuesday?,Benzinga,Looking for stock market analysis and research with proves results? Zacks.com offers in-depth financial research with over 30years of proven results.,https://finnhub.io/api/news?id=f3645962a07c0958b40ce01d19b33ec31bede22912a38c21e78b8bd7febbd9cf
2023-08-01 05:56:04,Meta preparing to launch chatbots with personas - FT,Yahoo,"Investing.com -- Meta Platforms (NASDAQ:META) is preparing to release new artificial intelligence-powered chatbots that have different personalities, according to a report in the Financial Times, as the Facebook parent attempts to boost user engagement.",https://finnhub.io/api/news?id=303b17ddb2c74dc865fa6b799b6ed9b12a2a3c8d6f908579daee88906a009959
2023-08-01 05:35:06,Meta prepares AI-powered chatbots in attempt to retain users - FT,Finnhub,"Meta Platforms is preparing
to launch a range of artificial intelligence  powered
chatbots that exhibit different personalities as soon as
September, the Financial Times reported on Tuesday.
         ...",https://finnhub.io/api/news?id=eab20df4a51b3bf478c7b8be529c1c1804c1dd2331ae458b28020fa9cc326e62
2023-08-01 05:23:20,"Busy earnings day, Meta reportedly prepares AI chatbot - what's moving markets",Yahoo,"Investing.com -- Investors are preparing to sift through a deluge of corporate results on Tuesday from big-name brands like Merck, Starbucks and Caterpillar . Meanwhile, Facebook-owner Meta Platforms is reportedly gearing up to launch a new artificial intelligence chatbot that can take on the personas of different characters. Elsewhere, a bright pulsating sign on the roof of the headquarters of Elon Musk's newly-renamed social media group X is taken down after sparking controversy with local res",https://finnhub.io/api/news?id=c1468d815df51795558ed1d08074f25d462732b97be5b2b0e215e7676586beb4
2023-08-01 04:56:00,Chatbots sometimes make things up. Is AI’s hallucination problem fixable?,"Associated Press, The",Looking for stock market analysis and research with proves results? Zacks.com offers in-depth financial research with over 30years of proven results.,https://finnhub.io/api/news?id=4381d249fec855d29e954d25022d635cf7fd4f0cf05355120ca3d45c7c9fe586
2023-08-01 04:51:00,"Meta to launch AI chatbots with 'personas,' FT reports",Thefly.com,Looking for stock market analysis and research with proves results? Zacks.com offers in-depth financial research with over 30years of proven results.,https://finnhub.io/api/news?id=9dcd8557963e197b5e1194e04446e41cae8a591abbf49fbd50042cd2e2267ac4
2023-08-01 04:43:00,Instagram CEO Prioritizes Products for Teens and Creators and Reels Account for Nearly 50% of Time Spent on Platform: Analyst,Benzinga,Looking for stock market analysis and research with proves results? Zacks.com offers in-depth financial research with over 30years of proven results.,https://finnhub.io/api/news?id=247ec8659937a733b299f91b2ab4e06bc6c0d662d9b64cd74c03462f51a7be51
2023-08-01 04:38:00,Meta Platforms Inc. stock outperforms market on strong trading day,MarketWatch,Looking for stock market analysis and research with proves results? Zacks.com offers in-depth financial research with over 30years of proven results.,https://finnhub.io/api/news?id=dc3dd335ababdbc0b0fefad9401cb824a1a23dc7408cbda574362ea3aadc2d01
2023-08-01 04:29:00,"Mark Zuckerberg's Next Bet To Appeal Users On Facebook, Instagram Could Be AI-Powered Chatbots",Benzinga,Looking for stock market analysis and research with proves results? Zacks.com offers in-depth financial research with over 30years of proven results.,https://finnhub.io/api/news?id=ad175a9488adb3b2f9de10d7a931d4577de241494da8c00446a4d6f4c456bdfc
2023-08-01 04:25:00,Meta ending news availability in Canada to comply with Online News Act,Thefly.com,Looking for stock market analysis and research with proves results? Zacks.com offers in-depth financial research with over 30years of proven results.,https://finnhub.io/api/news?id=03eb49280440465c1cdaa8191b75a4ce2e8a4738f6dbc07ce5902bff2c53042a
2023-08-01 04:14:00,Meta plans launch of AI bots with different personas in attempt to retain users - report,Seeking Alpha,Looking for stock market analysis and research with proves results? Zacks.com offers in-depth financial research with over 30years of proven results.,https://finnhub.io/api/news?id=4d8521e6e6abfb47faeb432d1f5780fd03aad89eda492aa06e850522da4a0eb9
2023-08-01 04:00:13,Meta prepares chatbots with personas to try to retain users,Yahoo,"Facebook owner seeks to seize on hype for AI while challenging rivals such as OpenAI, Snap and TikTok",https://finnhub.io/api/news?id=12522a038e1f3a2193b25f99082df553dcdb75620960b4105d64a4ada71ffcba
2023-08-01 02:56:00,Meta Platforms (NASDAQ:META) to Crowd AI Space with Chatbots,TipRanks,Looking for stock market analysis and research with proves results? Zacks.com offers in-depth financial research with over 30years of proven results.,https://finnhub.io/api/news?id=bf001af1515567d11bfd01c53b14e1684d65fb752e869c7ee5f13c0bd462123f
2023-08-01 02:22:00,Pinterest Earnings Today (NYSE:PINS): Here’s What to Expect from Q2,TipRanks,Looking for stock market analysis and research with proves results? Zacks.com offers in-depth financial research with over 30years of proven results.,https://finnhub.io/api/news?id=98aa43b732f848007e142050ca3f233d59860345d6daf5a90038d481f05e5633
2023-07-31 21:31:58,"Arista Slays Bears As Earnings Beat Amid Microsoft, Meta Worries",Yahoo,Arista Networks reported second-quarter earnings and revenue that topped analyst estimates. ANET stock popped as its outlook came in above views.,https://finnhub.io/api/news?id=6e93d4c9e69ac147f86af3a827895530e8d4df0b34f0d395338954f02de830b7
2023-07-31 21:01:39,The 2023 stock market rally got a lot healthier in June and July,Yahoo,"After narrow leadership earlier in the year, broader participation in this year's stock market rally helped turn aside one of the most popular bear cases that nagged markets into the summer months.",https://finnhub.io/api/news?id=7a1d30008e1c54c4c108cac7732e262f5172afafb935835e066098b8f42bd09a
2023-07-31 20:52:44,"S&P 500, Nasdaq rise for fifth month in a row",Yahoo,"Both the S&P 500 and the Nasdaq Composite closed higher on Monday. The indices also closed higher for the month of July, making it five-straight months of gains for both. Yahoo Finance Markets Reporter Jared Blikre breaks down what drove the market action.",https://finnhub.io/api/news?id=9a3339d4c6f291178d9c4cfb7f84590a260e65d78c95a3a1676779e6b5bbe4e0
2023-07-31 20:24:28,"Apple, Meta Hot Streaks Fuel Nasdaq 100’s July Rally",Yahoo,"(Bloomberg) -- Major technology and internet stocks have rallied throughout this year, with July the latest in a lengthy streak of monthly gains. Most Read from BloombergAsia’s Richest Families Fuel Race for Lucrative Finance JobsUS, Europe Are Growing Alarmed by China’s Rush Into Legacy ChipsLots of US Homeowners Want to Move. They Just Have Nowhere to GoA 5% US Mortgage Rate Is Seen as Tipping Point to Unlock SupplyWhy China’s Miracle Growth Story May Be Coming to an EndThe Nasdaq 100 Index ro",https://finnhub.io/api/news?id=460a32c871f04bc40e42240a61cdd8187c90795359bd8becb6ebd2e00c9a05b1
2023-07-31 20:16:00,"In Latest Letter, Elon Musk’s Lawyer Pushes Back on Research About Hate Speech",Yahoo,"Musk lawyer Alex Spiro sent a warning letter to the Center for Countering Digital Hate, alleging that firm's research about Twitter and hate speech was false and misleading. The nonprofit stood by the research.",https://finnhub.io/api/news?id=0efc43222935356574de2a79f815a27cbba620db1cffd710e3832067cd6b0570
2023-07-31 19:28:39,Meta's stock just wrapped up its ninth straight monthly gain as Wall Street cheers cost cuts ,CNBC,"Meta shares are skyrocketing, underscoring investor optimism regarding profitability and a recovery in the company's online ad business.",https://finnhub.io/api/news?id=a1d64319726c297ea8c77a0b9bbc913065bb68c81fa5f8b4c13e366cf6a89605
2023-07-31 17:47:12,3 Things That Make No Sense About This Market,SeekingAlpha,The U.S. central bank has now raised its Fed Funds rate by 525 bps since March 2022. Read more to see 3 reasons the next major market move is likely to be down.,https://finnhub.io/api/news?id=1cd7c73f53ab167d8681bd32f773572a9eac6b3735940e483d773da1027ff6cc
2023-07-31 16:15:58,Are We In A Stock Market Bubble? No!,SeekingAlpha,P/E ratios alone don't accurately measure stock market valuation as they fail to capture future expectations and cash-based intrinsic value. Click here to read more.,https://finnhub.io/api/news?id=ec187a3ade3a90b0ad9a1d2ca02e8b7707cedf1e382eb0c3aab7ec51f0e18b63
2023-07-31 13:49:00,The New York Times Co. (NYT) Flourishes on Subscriber Growth,Yahoo,The New York Times Company (NYT) foresees second-quarter 2023 subscription revenues to increase about 6-8%.,https://finnhub.io/api/news?id=41e029e29f73cb5617cbb8c3c1e569833c1f39e4070bb4304c15144d2cb87b7d
2023-07-31 13:43:15,Meta Platforms: The Big Rebound,SeekingAlpha,"Less than a year ago, Meta stock was sitting at $90/share. Today, the stock is within 15% from its all-time highs. Click here to read my analysis of META stock.",https://finnhub.io/api/news?id=53dfcc375c7a8e17dc399cbc7b56d28fdb166df9a82c929ce94bb4387f4062c9
2023-07-31 13:35:09,Apple: Berkshire Might Hold It Forever; You Might Do So Too,SeekingAlpha,"Apple represents more than 40% of Berkshire's stock portfolio, and it's possible that it never sell its shares. Learn why I rate AAPL stock a hold.",https://finnhub.io/api/news?id=87a9a3992c1390c72bc79ab38f724cb0bf736b2fcc9cce35af0ce3bfb83130f9
2023-07-31 13:10:00,It’s Halftime for Big Tech Earnings. Here’s Apple and Amazon Are Up Next.,Yahoo,"AI hopes fueled a furious first-half rally for tech stocks. Now, it looks like advertising and the cloud could continue the gains.",https://finnhub.io/api/news?id=675d108f4ea40ce916b60442eb9f80472d703a6d59e408eb06cd532bf9c96af4
2023-07-31 13:09:49,3 Stocks to Buy If They Take a Dip,Yahoo,"The market is on a tear since October. If it dips from here, these stocks could make excellent additions to your portfolio.",https://finnhub.io/api/news?id=e08b4e418d27ccc94ee6da2f5b0d6e838ce48ad31a4381bb153dab942dc6aecc
2023-07-31 12:55:13,Democrat-led states support Biden in fight over moderating social media content,Finnhub,"A group of Democratic state
attorneys general has urged a federal appeals court to lift an
order sharply curbing the ability of government officials to
push social media companies to moderate content...",https://finnhub.io/api/news?id=12e578c7fe6e80aae5a10724fe6aa810ec5233ea966dfc298db252d9ae3cb10f
